{
  "$schema": "http://json-schema.org/draft-07/schema#",
  "type": "object",
  "title": "Individual Transactions Schema",
  "definitions": {
    "countryCodePattern": {
      "type": "string",
      "pattern": "^[A-Z]{2}$"
    },
    "currencyIdPattern": {
      "type": "string",
      "pattern": "^ISO_4217:[A-Z]{3}$|^ISO_24165:[A-Z0-9]+(:[A-Z0-9]+)?$"
    },
    "bigDecimalPattern": {
      "type": "string",
      "pattern": "^[+-]?[0-9]+(\\.[0-9]+)?([eE][+-]?[0-9]+)?$"
    },
    "accountingPeriodPattern": {
      "type": "string",
      "pattern": "^[0-9]{4}-[0-9]{2}$"
    },
    "timestampPattern": {
      "type": "string",
      "pattern": "^\\d{4}-\\d{2}-\\d{2}T\\d{2}:\\d{2}:\\d{2}(?:\\.\\d+)?Z$"
    }
  },
  "properties": {
    "metadata": {
      "type": "object",
      "properties": {
        "creation_slot": {
          "type": "integer",
          "minimum": 0
        },
        "version": {
          "type": "string"
        },
        "timestamp": {
          "$ref": "#/definitions/timestampPattern"
        }
      },
      "required": ["creation_slot", "version", "timestamp"]
    },
    "org": {
      "type": "object",
      "properties": {
        "country_code": {
          "$ref": "#/definitions/countryCodePattern"
        },
        "name": {
          "type": "string"
        },
        "tax_id_number": {
          "type": "string"
        },
        "id": {
          "type": "string"
        },
        "currency_id": {
          "$ref": "#/definitions/currencyIdPattern"
        }
      },
      "required": ["country_code", "name", "tax_id_number", "id", "currency_id"]
    },
    "type": {
      "type": "string",
      "enum": ["INDIVIDUAL_TRANSACTIONS"]
    },
    "data": {
      "type": "array",
      "items": {
        "type": "object",
        "properties": {
          "date": {
            "type": "string",
            "format": "date"
          },
          "number": {
            "type": "string"
          },
          "batch_id": {
            "type": "string"
          },
          "id": {
            "type": "string"
          },
          "type": {
            "type": "string",
            "enum": [
              "CardCharge",
              "VendorBill",
              "CardRefund",
              "Journal",
              "FxRevaluation",
              "Transfer",
              "CustomerPayment",
              "ExpenseReport",
              "VendorPayment",
              "BillCredit"
            ]
          },
          "items": {
            "type": "array",
            "items": {
              "type": "object",
              "properties": {
                "amount": {
                  "$ref": "#/definitions/bigDecimalPattern"
                },
                "event": {
                  "type": "object",
                  "properties": {
                    "code": {
                      "type": "string"
                    },
                    "name": {
                      "type": "string"
                    }
                  },
                  "required": ["code", "name"]
                },
                "project": {
                  "type": "object",
                  "properties": {
                    "cust_code": {
                      "type": "string"
                    },
                    "name": {
                      "type": "string"
                    }
                  },
                  "required": ["cust_code", "name"]
                },
                "cost_center": {
                  "type": "object",
                  "properties": {
                    "cust_code": {
                      "type": "string"
                    },
                    "name": {
                      "type": "string"
                    }
                  },
                  "required": ["cust_code", "name"]
                },
                "document": {
                  "type": "object",
                  "properties": {
                    "number": {
                      "type": "string"
                    },
                    "currency": {
                      "type": "object",
                      "properties": {
                        "cust_code": {
                          "type": "string"
                        },
                        "id": {
                          "$ref": "#/definitions/currencyIdPattern"
                        }
                      },
                      "required": ["cust_code", "id"]
                    },
                    "vat": {
                      "type": "object",
                      "properties": {
                        "cust_code": {
                          "type": "string"
                        },
                        "rate": {
                          "$ref": "#/definitions/bigDecimalPattern"
                        }
                      }
                    },
                    "counterparty": {
                      "type": "object",
                      "properties": {
                        "cust_code": {
                          "type": "string"
                        },
                        "type": {
                          "type": "string"
                        }
                      },
                      "required": ["cust_code", "type"]
                    }
                  },
                  "required": ["number", "currency"]
                },
                "id": {
                  "type": "string"
                },
                "fx_rate": {
                  "$ref": "#/definitions/bigDecimalPattern"
                }
              },
              "required": ["amount", "event", "id", "fx_rate", "document"]
            }
          },
          "accounting_period": {
            "$ref": "#/definitions/accountingPeriodPattern"
          }
        },
        "required": ["date", "number", "batch_id", "id", "type", "items", "accounting_period"]
      }
    }
  },
  "required": ["metadata", "org", "type", "data"]
}
